{"id":"a1","name":"Tiësto","theme":"Progressive house","description":"Nizozemský DJ a producent s kořeny v trance. Postupně rozšířil svůj zvuk o house a další podoby taneční elektroniky. Pochází z nizozemské Bredy.","date":"2027-08-01","startTime":"12:30:00","endTime":"13:30:00","highlight":false,"dayId":"d1","venueId":"h1","venueName":"Main Hall","performerIds":["i4"],"performers":["Tiësto"]}